title,genre,description
The Shawshank Redemption,Drama,"Two imprisoned men bond over a number of years, finding solace and eventual redemption through acts of common decency."
The Godfather,Crime,"An organized crime dynasty's aging patriarch transfers control of his clandestine empire to his reluctant son."
The Dark Knight,Action,"When the menace known as the Joker emerges from his mysterious past, he wreaks havoc and chaos on the people of Gotham."
Pulp Fiction,Crime,"The lives of two mob hitmen, a boxer, a gangster's wife, and a pair of diner bandits intertwine in four tales of violence and redemption."
Forrest Gump,Drama,"The presidencies of Kennedy and Johnson, the Vietnam War, the Watergate scandal and other historical events unfold through the perspective of an Alabama man with an IQ of 75."